titulo,autor,data,secao,texto,url
,,,,"Se o Leste Asiático fosse uma escola, o Japão seria aquele aluno que ouve as provocações de um valentão capaz de explodir a cidade inteira com um botão, mas se preocupa mesmo é com o rancor de outro colega - aquele que sofreu bullying quando era mirrado, virou o fortão da vizinhança e junta em silêncio armas em casa. Sem dizer a ninguém exatamente quantas.Aos 103 anos, o japonês Masao Horie acompanhou como poucos a mutação geopolítica que forjou a atual relação do Japão com a valentona Coreia do Norte e a encorpada China. Ele é um dos soldados do Império Japonês que invadiram a China na chamada Segunda Guerra Sino-Japonesa (1937-1945), conflito que logo se confundiria com a frente asiática da 2.ª Guerra (1939-1945).Foram três anos combatendo em solo chinês, país que percorreu de norte a sul em batalhas contra tropas locais e ocidentais, que chegaram em socorro aos chineses. Horie viveu o bastante para acompanhar a sucessão de ditadores na Coreia do Norte desde sua criação, em 1948. Viu o atual, Kim Jong-un, disparar dois mísseis que sobrevoaram o Japão e suas cerejeiras em 2017. Nem mesmo isso o leva a preocupar-se mais com a Coreia do Norte do que com a China. E ele não está só.O entrevistou separadamente quatro especialistas do governo japonês com acesso a dados reservados sobre o arsenal chinês e as incursões de navios e aviões de Pequim em áreas que o Japão considera suas.  Estes funcionários japoneses, um dos quais viveu na China dois anos, consideram a Coreia do Norte um impasse que pode ser resolvido no curto prazo. Insistem que o problema central é a mudança no equilíbrio de poder da região.""A Coreia do Norte não tem nada além de armas nucleares. Se a desnuclearização for feita, talvez tudo fique certo. Com a China é diferente. Não é só uma questão militar. A hegemonia no século está em jogo, está em jogo qual superpotência dominará"", concorda Masahiro Kohara, professor de direito e política na Universidade de Tóquio. ""O Japão e outros países da região estão no meio de duas superpotências. Às vezes, eles têm relações militares com os EUA e comerciais com a China. O Japão não é exceção"", completa. Pelo menos três fatores justificam essa preocupação.Nos últimos dez anos, a China mais que dobrou seu gastos em defesa. O Japão elevou suavemente os seus, passando agora da casa do 1% do PIB. O orçamento militar declarado pela China é 5 vezes o do Japão, e a diferença tende a aumentar. Após deixar a vida militar, Horie foi senador e, em função de seu histórico, passou a ser referência no tema.""Principalmente depois do fim da URSS, os países europeus ocidentais reduziram muito o investimento em defesa. O Japão fez a mesma coisa e hoje depende essencialmente dos EUA. Não podemos depender 100%"", lamenta.Essa dependência dos americanos desperta nele sentimentos contraditórios. Após combater na China, foi enviado para Nova Guiné, em 1943, onde passou três anos lutando contra os Aliados. Dos 150 mil combatentes japoneses na região, 130 mil morreram. A maioria, vítima de fome e doenças tropicais.""A diferença de armamento era gigante. Estávamos a 5 mil quilômetros do Japão, não havia comida, e a filosofia militar era não ser capturado. Havia duas alternativas, atacar ou se suicidar. Eu estava perto de morrer quando o imperador declarou a rendição. Duvidei sobre o que fazer, pois o território principal japonês não tinha sido invadido. Só quando voltei e vi a destruição da bomba atômica, me conformei"", diz Horie, que estudou em Hiroshima, uma das cidades-alvo, ao lado de Nagasaki. ""Depois disso, os EUA transformaram o Japão no que queriam, algo que nunca havia ocorrido em 2 mil anos. O povo ficou perdido, mas os EUA ajudaram porque não tínhamos nada para comer"", reflete.Uma das linhas da política externa do presidente americano, Donald Trump, é dizer que os EUA não devem ser a polícia do mundo e logo cobrar mais por este papel. ""Trump não está interessado em garantir uma defesa forte, isso é um grande problema. Isso muda a relação que os países são obrigados a ter com a China"", diz o professor Kohara. Para Robert Dujarric, diretor do Instituto de Estudos Asiáticos da Universidade Temple, ainda que Trump tenha se tornado um inimigo do sistema internacional desenhado pelos próprios EUA, ""qualquer ataque ao Japão levaria provavelmente a uma guerra entre EUA e China"".Após a 2.ª Guerra, os EUA estabeleceram limites rigorosos ao armamentismo japonês, consolidados na chamada Constituição Pacifista. Seu artigo 9.º proíbe o Japão de ter um Exército. Permite sim forças de autodefesa, conceito que vem sendo flexibilizado com a adaptação de dois porta-helicópteros para operar como porta-aviões e a compra de caças F-35 - seriam 105 ao todo, ao custo de US$ 10 bilhões, dos quais 42 F-35B, que fazem pousos verticais.Além de lidar com críticas a cada aquisição de armamento, o Japão enfrenta outro problema para encorpar sua ""autodefesa"". Os jovens não estão interessados na carreira, admitem funcionários do governo. Morador de Tóquio, Miyoshi Hiroaki, de 25 anos, faz uma careta sob a máscara com a qual previne resfriados, ao ser questionado sobre o tema. ""Não me preocupo com essas coisas."" Questionado sobre o que seriam ""essas coisas"", o jovem, que se dedica à produção de propaganda para a internet e nunca pensou em entrar para a autodefesa, esclarece: ""China e Coreia do Norte"".Horie pondera que esse desinteresse faz parte de outra grave ameaça ao Japão, esta interna, que ele considera tão perigosa quanto a valentona Coreia do Norte e a marombada China: o envelhecimento populacional. Até 2050, o país tende a perder 30 milhões de habitantes. ""Não é só para a Defesa. Na indústria em geral faltam jovens"", afirma o homem que ingressou na escola militar aos 14 anos, foi casado durante 75 anos (sua mulher morreu aos 95) e credita sua longevidade à boa alimentação. ""Fui comandante em Nova Guiné por três anos e nunca fiquei ferido. As balas atingiam meus subordinados e nunca me atingiram. Acho que também tive sorte.""",https://www.gazetadopovo.com.br/mundo/arsenal-vizinho-preocupa-o-japao-e-nao-e-o-de-kim/

,,,,"Uma das coisas mais certas no Brasil é que, sempre que uma crise envolve a Presidência da República, o tema parlamentarismo volta a rondar o cenário político. Este ano, com as trocas de farpas entre o presidente Jair Bolsonaro (PSL) e o Congresso, deputados com mais tempo de Câmara se movimentaram em torno da ideia de propor que o presidente da Câmara, Rodrigo Maia (DEM-RJ), estabeleça uma comissão para um “debate profundo” sobre a mudança de regime.Com a bandeira branca sinalizada de ambos os lados – Bolsonaro e Maia trataram das ""caneladas"" trocadas recentemente como “página virada” e “assunto encerrado” – o tema deve esfriar.  Mas nem tanto. Em entrevista ao jornal  , o presidente nacional do Cidadania (ex-PPS), Roberto Freire, defendeu a mudança para o parlamentarismo para o próximo governo, a ser eleito em 2022. O regime é uma bandeira histórica do partido, que informa que o assunto segue em constante discussão interna, ainda que, por enquanto, não haja uma ação formal em curso no Congresso por parte da legenda.Em 29 de maio do ano passado, a então presidente do Supremo Tribunal Federal (STF), Uma semana depois, a ministra retirou o julgamento da ação da pauta da corte.Antes disso, em agosto de 2017, o então presidente Michel Temer (MDB) disse, em entrevista ao programa do colunista Reinaldo Azevedo na Band News FM, que a adoção do parlamentarismo a partir do ano seguinte “não seria despropositado”. Sua defesa ao regime aconteceu logo após se livrar de uma investigação por corrupção pela Câmara dos Deputados. Curiosamente, o ex-deputado Eduardo Cunha, preso desde outubro de 2016 e condenado a 15 anos de prisão por recebimento de propina em contas no exterior por contratos da Petrobras, também defendeu a adoção do sistema.Em julho de 2017, o então presidente do Senado, Eunício Oliveira (MDB-CE), afirmou que uma comissão para discutir a implementação do regime parlamentarista seria instalada no mês seguinte. Em março de 2016, a casa havia aprovado um requerimento para a criação de uma comissão para analisar uma possível mudança para o parlamentarismo ou semipresidencialismo. Senadores da oposição conseguiram convencer o presidente da casa à época, Renan Calheiros (MDB-AL), a postergar a instalação da comissão. As discussões ocorriam em meio ao embate entre governo e legislativo, que culminou com o impeachment da presidente Dilma Rousseff (PT).A principal diferença entre os dois regimes políticos está na divisão de forças entre os poderes Executivo e Legislativo. No parlamentarismo, as ações executivas do governo são exercidas pelo primeiro-ministro, cuja nomeação precisa do aval da maioria parlamentar, e cabe ao presidente da República a representação do Estado, por exemplo, em questões internacionais. No presidencialismo, essas duas atribuições se concentram nas mãos do chefe do Executivo.Com algumas variações, o parlamentarismo é o sistema
utilizado por quase todos os países europeus, enquanto o presidencialismo é o
modelo adotado pelos Estados Unidos e pela maioria dos países da América Latina,
além de grande parte da África e da Ásia Central.No parlamentarismo clássico, aplicado em monarquias
constitucionais como o Reino Unido e em repúblicas democráticas como a
Alemanha, o Congresso escolhe o primeiro-ministro, normalmente o líder do
partido ou da coalizão majoritária. O monarca ou um presidente eleito
indiretamente pelo Parlamento exerce a chefia de Estado. Em países como França
e Portugal, há uma variação conhecida como semipresidencialismo, com eleição
direta para presidente da República, que indica o primeiro-ministro. A
indicação, no entanto, precisa ser aprovada pelos parlamentares.“Para mim, [a discussão sobre a volta do parlamentarismo] funciona como retórica para reduzir o poder do Executivo”, analisa Maria do Socorro Braga, cientista política da Universidade Federal de São Carlos (UFSCar).  “A minha crítica em cima dessa visão é que, em um sistema parlamentarista, a gente tem partidos que têm  quase a maioria [no parlamento], e a gente não tem isso no Brasil. Antes disso, a gente vai precisar mudar certos dispositivos e instituições no país, mudar o sistema eleitoral, o tipo de forma, tem muito mais mudanças a serem desenvolvidas. Penso que hoje não há clima nenhum para fazer algum tipo de reforma política séria”, acrescenta.Ela destaca que, nos momentos recentes de crise, tanto no impeachment da Dilma quanto nas acusações que envolveram Temer, vê-se o Legislativo independente do Executivo, agindo de forma proativa - como acontece em alguns regimes parlamentaristas.A cientista política entende que Bolsonaro demonstra
dificuldades para manejar os mecanismos que fazem o Executivo forte. Uma dessas
inabilidades está na distribuição, a seu ver, equivocada de poder. “É preciso distribuir,
dividir poder. No que ele [Bolsonaro] não faz isso, não consegue formar uma
base parlamentar para governar. Ele colocou generais para ocupar ministérios,
não vai funcionar assim. Ou ele coloca os partidos que o apoiam para dentro, e
assim ele forma uma base, ou ele vai ficar refém do Legislativo, como a Dilma
ficou do [ex-deputado Eduardo] Cunha.”Professor de Ciência Política da Universidade Federal do Paraná (UFPR), Paulo Roberto Neves Costa amplia a discussão para além da – até o momento demonstrada – falta de habilidade do atual presidente da República no relacionamento com o Congresso. Ele defende que é preciso considerar inabilidades também no Legislativo, e que isso não seria resolvido pela simples adoção do regime parlamentarista. “Só temos problemas no âmbito do Executivo? O funcionamento  do governo também seria um problema no parlamentarismo, só que institucional e politicamente mais restrito, embora dificilmente passasse por uma alteração profunda em apenas 100 dias de governo.”O ponto positivo a favor do parlamentarismo, explica, seria
uma forma menos emocional e errática de composição de um governo desde o processo
eleitoral, com um significado mais programático e previsível atribuído ao
próprio governo, e uma referência mais precisa dos interesses em jogo tanto
para a oposição quanto para a população sobre o que esperar do Executivo.“Normalmente, quando o presidencialismo de coalizão funciona, a gente tem uma agenda em comum entre o Legislativo e o Executivo”, retoma Maria do Socorro. “A ideia é que os partidos que apoiam o presidente, que por sua vez divide o poder no Executivo, colaborem com o Executivo na esfera legislativa.” O que evitaria, por exemplo, as tão tradicionais ameaças de pautas-bomba, ou  por parte de parlamentares como forma de colocar o governo federal contra a parede.O país passou por momentos parlamentaristas em algumas
ocasiões: no século 19, durante o 1º e o 2º Reinados (com o imperador exercendo
o Poder Moderador e nuances diferentes do parlamentarismo clássico), e entre
1961 e 1963, durante o governo João Goulart. Uma expectativa de adoção do
regime pairou sobre o país por alguns meses entre 1987 e 1988, até que a
disputa política na Assembleia Nacional Constituinte, que escreveu a Constituição
de 1988, manteve a tradição presidencialista.Plebiscito realizado em 21 de abril de 1993 confirmou, com larga
vantagem, a preferência da população pelo regime que vigora no país até hoje: enquanto
24,87% optaram pelo parlamentarismo, 55,58% defenderam o presidencialismo, e
19,55% votaram em branco ou nulo.“O plebiscito de 1993 é a confirmação da forma precária como
o parlamentarismo vem sendo colocado como alternativa de modelo político, seja
entre aqueles que estão ocupando cargos políticos, seja para a sociedade
brasileira”, critica Costa. Para ele, seria temerário um movimento de defesa do
parlamentarismo nos moldes do debate eleitoral do ano passado, com a
polarização política levada a níveis extremos. “O debate sobre o parlamentarismo
só ganharia substância se mostrasse as mazelas não apenas do governo atual, mas
do presidencialismo e, principalmente, fosse não apenas aceito como também
compreendido pela população”.Costa diz ser importante estudar detalhadamente esse
fenômeno que, a cada crise política, traz o assunto da adoção do regime
parlamentar à tona, e por entender que o tema é apresentado de forma rasa
nesses momentos de tensão entre Legislativo e Executivo, evita até chamar de
debate. “Não podemos desprezar a oportunidade que essas situações trazem para
pensar formas de aprofundar a democracia e tirar dela proveitos para a
sociedade, mas não se pode vincular este debate às ondas de crise do governo em
vigência, como pode estar acontecendo agora”.Em 2015, foi lançada a Frente Parlamentar Franco Montoro em Defesa do Parlamentarismo, com apoio de 225 deputados. A frente defende a PEC 20/95, do ex-deputado federal Eduardo Jorge (PV-SP). A PEC se aproxima mais do semipresidencialismo francês do que do parlamentarismo clássico inglês. Ainda não foi votada em plenário e prevê a realização de um referendo após ser aprovada pelo Congresso.Pela proposta, a administração do país caberia ao presidente
de um conselho de ministros (primeiro-ministro). O nome seria indicado pelo
presidente da República, mas precisaria ter o programa de governo aprovado por
maioria absoluta da Câmara dos Deputados. Em caso de duas rejeições, caberia à
Câmara fazer a indicação.Esse conselho responderia coletivamente perante a Câmara dos
Deputados pela política do governo e pela administração federal. O presidente
do Conselho de Ministros deveria ter idade mínima de 35 anos e precisaria
obrigatoriamente ser um deputado ou senador. O presidente continuaria sendo
eleito por voto direto e teria as funções de presentar o Brasil
internacionalmente e comandar as Forças Armadas. Já o primeiro-ministro
cuidaria apenas da gestão do Poder Executivo.A alteração para o regime parlamentarista daria mais força à Câmara dos Deputados. Ela poderia ser dissolvida, porém, a pedido do presidente, em caso de uma sequência de discordâncias com o primeiro-ministro. O Senado e o presidente ficariam com funções institucionais, menos práticas. O gabinete e o primeiro-ministro ganham poder e, ao mesmo tempo, são mais vigiados pelos deputados.",https://www.gazetadopovo.com.br/republica/debate-parlamentarismo-brasil/

,,,,"Começa na próxima  a campanha de vacinação nacional contra a doença, que em Curitiba estará disponível em 110 unidades de saúde. Para conseguir a dose gratuita, porém, é preciso enquadrar-se no grupo prioritário definido pelo Ministério da Saúde.De acordo com a prefeitura da capital, em um primeiro momento, a vacinação será exclusiva para gestantes, crianças de 6 meses até 6 anos incompletos, e puérperas (mães recém-nascidos de até 45 dias). Apenas os integrantes deste grupo poderão receber a dose até o dia 19 de abril. Após esse prazo, a imunização passará a valer também para as outras pessoas do grupo prioritário, como idosos. A campanha .O motivo dos dias exclusivos para o grupo de gestantes e bebês é que, em todas as campanhas de anos anteriores, estas foram as pessoas que ficaram com índices de vacinação abaixo do esperado em todo o Brasil.Este ano, a vacina ofertada pelo Sistema Único de Saúde (SUS) é trivalente, e não é a mesma que foi aplicada em 2018. Por isso, o Ministério da Saúde alerta para a importância de tomar a dose atual, mesmo para quem já foi vacinado em 2018. A dose deste ano previne contra dois tipos de gripe A e um de gripe B, protegendo de vírus como o H1N1 e o H3N2. A vacinação ocorrerá de segunda à sexta-feira, no horário de atendimento das unidades de saúde. A vacinação é ofertada apenas nas unidades básicas e não será feita nas Unidades de Pronto Atendimento (UPAs), locais destinados apenas ao atendimento de casos de urgência e emergência.A meta, em Curitiba, é vacinar pelo menos 90% das 535 mil pessoas que integram o público-alvo — o que corresponde a 481,5 mil pessoas.Em 4 de maio haverá o “Dia D” da mobilização, um sábado em que alguns postos de saúde abrirão para ampliar o acesso aos usuários que desejam se vacinar.A partir de 19 de abril, a vacinação se estende a todos públicos definidos como prioritários pelo Ministério da Saúde, que, além das gestantes, puérperas e crianças entre 6 meses e 6 anos incompletos, inclui: ",https://www.gazetadopovo.com.br/curitiba/vacinacao-gripe-curitiba-comeca-nessa-semana/

Tarsila do Amaral 1: a artista do século e seu plano,,,,,https://www.gazetadopovo.com.br/colunistas/jorge-caldeira/tarsila-do-amaral-1-a-artista-do-seculo-e-seu-plano/

,,,,,https://www.gazetadopovo.com.br/bomgourmet/o-brasileiro-que-conquistou-portugal-fazendo-sushi/

,,,,"O ex-presidente  participou nos Estados Unidos de um painel sobre as crises recentes na América Latina, e é claro que a Venezuela foi um dos principais assuntos. Um possível apoio do governo brasileiro à uma intervenção americana no país vizinho foi criticada por FHC. “A experiência histórica nos demonstrou que quando temos uma ação militar que vem de fora não traz resultados positivos, ou leva muito tempo para dar”, afirmou, citando exemplos das guerras na Líbia e Iraque. “Se paga um preço muito elevado ao usar a força militar. E quem vai pagar? O povo venezuelano e nós também vamos pagar um certo preço.”Fernando Henrique está em Boston participando da Brazil Conference, evento que também contará com a presença do atual vice-presidente Hamilton Mourão. Em  Mourão também sem posicionou contra uma ação militar. “Nós temos deixado claro, e ficou claro no Grupo de Lima, que é o foro responsável em discutir essa situação, que nós não estamos pensando na opção militar.”FHC foi presidente do Brasil entre 1995 e 2002 - nos últimos três anos do seu mandato, a Venezuela já estava sob regime Chavista. O ex-presidente brasileiro definiu que Hugo Chávez “era um cara impulsivo, mas que tinha uma visão e capacidade de falar, diferentemente de Nicolás Maduro que o sucedeu”.Um possível conflito na Venezuela é visto pelo ex-presidente como uma disputa de poder e tecnológica entre Estados Unidos, Rússia e China, e que o Brasil tem que saber jogar o jogo. “Acho que o governo do Brasil tem uma responsabilidade. Tem que se dar conta que há interesses grandes que não são os nossos necessariamente. E que, principalmente, a Venezuela vai seguir sendo vizinho nosso para sempre, geograficamente. E essas marcas são fortes. Dependendo do que se faça no presente, se paga um preço muito caro no futuro.”Um dos exemplos citados por FHC foi o apoio militar que o
Brasil deu aos Estados Unidos na invasão à República Dominicana em 1965. “Foi
uma ação bélica, e nos custou para reestabelecer um certo equilíbrio e
prestígio internacional com a comunidade latino-americana por ter participado
de uma ação militar na Republica Dominicana. Não acho que seja o melhor caminho
uma intervenção militar na Venezuela”. Ele também explicou que uma ação militar
na Venezuela seria algo completamente diferente da Missão de Paz no Haiti que
durou de 2004 à 2017.Após três dias de painéis e palestras,  Brazil Conferece encerra neste domingo (7) com a ",https://www.gazetadopovo.com.br/republica/o-brasil-tem-que-se-dar-conta-do-jogo-de-interesses-que-ha-na-venezuela-diz-fhc/

,,,,"O ex-governador do Paraná foi solto por volta das 19 horas desta quinta-feira (4), beneficiado por um habeas corpus c. O tucano estava preso no Complexo Médico Penal, em Pinhais, desde o dia 19 de março, no âmbito da Operação Quadro Negro, que apura desvios de recursos públicos em obras de escolas. Ao deixar o local, dentro de um carro, o tucano não falou com a imprensa. Apesar da vitória no tribunal - a  pela soltura após 17 dias de detenção -, foram impostas medidas cautelares ao político. Ele terá de entregar o passaporte, não poderá ter contato com os demais réus, deverá se manter em recolhimento domiciliar durante a noite e nos fins de semana, além de ficar proibido de trabalhar para instituições públicas.Em nota oficial, a defesa de Beto Richa afirma que ""acredita na restauração de legalidade e que segue confiante nas instituições do Poder Judiciário, em especial do Tribunal de Justiça do Estado do Paraná"" e promete que ""esclarecerá no curso do processo todos os fatos necessários à demonstrar a inocência do ex-governador"".Trata-se da terceira prisão do tucano, que já foi alvo da , em setembro de 2018, e da , em janeiro deste ano. ",https://www.gazetadopovo.com.br/parana/beto-richa-solto-prisao/

