titulo,autor,data,secao,texto,url
,,,,"“Imbecil”, “Entreguista”, “Errático”. As críticas feitas ao
presidente Jair Bolsonaro (PSL) e aos seus três primeiros meses de mandato
foram bastante duras na noite de sexta-feira (6) em Harvard durante o Brazil
Conference, evento que está sendo realizado em Boston, nos Estados Unidos. Em
um debate em que participaram os ex-candidatos à presidência Geraldo Alckmin
(PSDB), Ciro Gomes (PDT) e Henrique Meirelles MDB), o início do Governo
Bolsonaro foi classificado como uma “grande confusão” e chamado de
“improvisado”.Geraldo Alckmin e Ciro Gomes foram mais incisivos em suas críticas ao atual presidente. Ciro, terceiro mais votado na última eleição, fez ataques pessoais à Bolsonaro “o Brasil optou por um idiota” “temos um imbecil líder de uma das maiores nações do planeta”. Alckmin, ex-governador de São Paulo, falou que “estranhamente há um derretimento muito rápido do Governo” e que o atual presidente comete erros ao criar factoides para discutir “se o Nazismo era de esquerda ou de direita ou se houve golpe em 64”. E desqualificou o termo ‘nova política’ usado por Bolsonaro. “Não existe nova e velha política, e sim boa e má política”. Já Henrique Meirelles, ex-ministro da Fazenda do governo
Michel Temer e atual Secretário da Fazenda e Planejamento do Estado de São
Paulo, questionou “o que o País está fazendo pra reverter esta
queda de produtividade, porque isso é que vai fazer a renda média dos
brasileiros aumentar e vai definir o padrão de vida da população brasileira”.A política externa do atual governo também foi duramente
criticada. Geraldo Alckmin a classificou como “errática” e afirmou que “estamos
criando sem necessidade nenhuma um atrito com o mundo árabe, num setor crítico
que é o agronegócio, isso é inadmissível”. Ciro Gomes manteve o mesmo tom do
tucano “O Brasil está insultando a China, nosso maior parceiro comercial” e ainda
falou sobre a aproximação com o Governo de Donald Trump chamando Bolsonaro de “entreguista”
e “traidor da pátria”, e que a visita recente à Casa Branca foi “uma vassalagem
vergonhosa, coisa nojenta”.A reforma da previdência foi um tema bastante discutido. Os
três ex-presidenciáveis admitiram a necessidade de se fazer uma reforma do atual
sistema, mas sem apoiar a reforma proposta pelo ministro da Economia Paulo
Guedes. “Vão fazer uma reforma só em cima do trabalhador pobre. Precisamos ter
foco na justiça social”, afirmou Geraldo Alckmin que disse que o Brasil precisa
de outras reformas, e lembrou que ele e o PSDB apoiaram a reforma trabalhista
do Governo Temer. “O custo do dinheiro é muito alto no Brasil, um conjunto de
reformas é importante. Reforma bancária, reforma tributária, reduzir o imposto
da pessoa jurídica”. Henrique Meirelles disse que o foco tem que estar “no
combate à desigualdade social e na questão da educação básica, que são grandes
problemas”.Geraldo Alckmin também propôs uma reforma política. “Nosso
modelo de sistema eleitoral parece equivocado, a sociedade mudou nas últimas
décadas. Os partidos políticos se enfraqueceram, estão artificiais”. Por outro
lado, Henrique Meirelles defendeu a atual democracia brasileira “fato concreto
que temos uma independência do Judiciário e do Ministério Público. O Brasil tem
tido eleições regulares desde o fim do Regime Militar”.Ciro Gomes falou da forte presença de militares no governo
Bolsonaro e disse que o distanciamento entre os generais e Bolsonaro é cada vez
maior. “Os militares estão horrorizados. Eles compreendem a vida. Não entendem
de política, mas compreendem de política”. O ex-candidato também afirmou que o
vice-presidente Hamilton Mourão “está cobiçando o cargo descuidadamente” e que
não tem certeza se Bolsonaro chegará ao fim do mandato. “O governo Bolsonaro
está na antecedência de uma grande confusão. Não é impeachment, não há
organização para isso. Talvez uma renúncia. Tem muito mais cara de Jânio
Quadros, despreparado, o exercício do poder sem compreender”, concluiu Ciro
Gomes que foi aplaudido pela plateia.Fernando Haddad, candidato do PT derrotado no segundo turno
das eleições, cancelou a sua participação no painel. Já o vice-presidente
Hamilton Mourão chegou na noite de sexta à Boston. Neste sábado (6),  Mourão irá se reunir com estudantes de Harvard
e representantes da comunidade brasileira em Massachusetts e no domingo (7)
fará a palestra de encerramento da Brazil Conference.",https://www.gazetadopovo.com.br/republica/derrotados-nas-eleicoes-criticam-bolsonaro-em-harvard-imbecil-e-entreguista/

,,,,"Na noite da última quarta-feira (3), em um bar da zona oeste de São Paulo, o Instituto Lula promoveu um leilão de 50 lotes de fotos doadas por diferentes fotógrafos profissionais que registraram imagens do ex-presidente  nas últimas décadas. Cada peça continha o autógrafo do autor da foto e do próprio ex-presidente.O evento rendeu ao caixa do instituto cerca de R$ 624 mil, e o dinheiro arrecadado servirá para tapar buracos nas finanças do instituto e também capitalizar a defesa do ex-presidente, que reclama da falta de recursos. Lula está preso desde 7 de abril de 2018 em um cela especial da Polícia Federal em Curitiba.LEIA MAIS: O ex-juiz federal Sergio Moro, que era o responsável pela Operação Lava Jato, bloqueou mais de R$ 600 mil de contas bancárias e cerca de R$ 9 milhões que estavam depositados em dois planos de previdência privada do ex-presidente. Além do dinheiro, apreendeu quatro imóveis e dois veículos. Também sofreu bloqueio o espólio da ex-primeira-dama Marisa Letícia, morta em fevereiro de 2017.O Instituto Lula vai usar boa parte do dinheiro obtido no leilão de fotos para pagar uma dívida que tem com a empresa Lils Palestras, que pertence ao ex-presidente, e que tem custeado os advogados que o defendem nos processos oriundos da Operação Lava Jato. ""A empresa de palestra [Lils Palestras] não tem nenhum recurso mais. Todo recurso que ela tinha se gastou para pagar a defesa do Lula"", diz Paulo Okamotto, presidente do Instituto Lula e sócio minoritário da Lils Palestras (Okamoto tem 2% da empresa, e Lula, 98%). ""Então a gente está estudando usar uma parte deste dinheiro [da venda das fotos] para pagar os advogados e a Lils. Devolver o dinheiro para a Lils do empréstimo que ela tinha feito para o instituto, para pagar os advogados"", completa Okamotto.Por lei, o Instituto Lula não pode custear a defesa do ex-presidente, mas sua empresa de palestras, sim. ""A Lils doou bastante dinheiro, uns R$ 700 mil para o Instituto Lula. Emprestou mais uns R$ 700 mil. Desde que começou a Lava Jato o instituto começou a ter mais dificuldade para arrecadar [com empresários]"", diz Okamotto.Advogados de Lula disseram à reportagem que estão com dificuldades para exercer a defesa do petista, desde o bloqueio das contas e dos bens do ex-presidente, decretado por Moro no início de 2018. Falta dinheiro para custear deslocamentos (Lula responde a processos em Curitiba e Brasília, além de São Paulo, onde ficam os advogados) e até para contratar pareceristas. Recentemente os juristas Lenio Streck e Geraldo Prado fizeram pareceres para Lula, mas de graça.O escritório de advocacia também mantinha uma página na internet para divulgar as posições da defesa de Lula sobre os andamentos da Lava Jato, um canal de resposta às divulgações feitas pela força tarefa da Lava Jato. Sem verba, o contrato com a equipe de quatro pessoas que cuidava do site foi rescindido. Segundo Okamotto, Lula já gastou de R$ 4 milhões ou R$ 5 milhões em sua defesa.Com o estrangulamento financeiro, o Instituto Lula precisou se readequar ao novo momento. ""Demitimos gente"", diz Okamotto. Segundo o presidente do instituto, houve cortes de pessoas na faxina, na manutenção e também na direção do instituto. Petistas que acompanharam Lula desde a fundação do PT e que exerciam cargos remunerados na direção da instituição foram desligados, caso de Clara Ant, que cuidava da agenda e de subsídios, Luiz Dulci, que tratava de movimentos sociais, e Paulo Vanucchi, que fazia ações na área de direitos humanos. Hoje eles só atuam de maneira voluntária e esporadicamente, segundo Okamotto. O salário de um diretor do Instituto Lula era de cerca de R$ 20 mil.Com o instituto e a empresa de palestras sem dinheiro, sobrou para o PT bancar um auxiliar para Lula em Curitiba. Um funcionário do partido, chamado Marco Aurélio, mudou-se para para a capital paranaense para dar suporte às necessidades do ex-presidente. A principal função do funcionário é receber e-mails de familiares, amigos e correligionários do petista, imprimir e levar para os dois advogados que visitam Lula diariamente. Eles entregam para o ex-presidente, que responde em cartas escritas à mão. Esses manuscritos, então, são levados para Marco Aurélio, que tira uma cópia e envia por e-mail para os destinatários.Além de Marco Aurélio, Lula tem quatro seguranças que se revezam em tarefas básicas como compra de materiais de higiene, roupa e alimentos para o petista, além de escoltar a família durante a visita. Por lei, todos os ex-presidentes têm direito a esses quatro seguranças, além de dois motoristas, dois carros oficiais à disposição e dois assessores.Conforme, as despesas com a equipe de assessores do ex-presidente somaram R$ 665 mil em 2018.  Tudo bancado pelo contribuinte. A maior parte da verba foi gasta com salários de assessores e seguranças – um total de R$ 551 mil, sendo um  deles com renda mensal média de R$ 12,3 mil. Antes da prisão, em 7 de  abril, havia também gastos com diárias, passagens e combustível dos  veículos à disposição do ex-presidente – pago com cartão corporativo. Essas despesas totalizaram R$ 114 mil.O benefício de Lula com assessoria e segurança chegou a ser cassado um mês após a prisão por decisão de um juiz federal de Campinas (SP). A defesa do petista recorreu e o TRF-3 (Tribunal Regional Federal da 3ª Região) restabeleceu o direito do ex-presidente a ter os assessores. Segundo os advogados, entre as funções dos seguranças de Lula está a de catalogar as mais de 30 mil cartas que o ex-presidente recebeu desde que foi preso. Boa parte das correspondências chega até Lula na prisão. O ex-presidente também recebe presente de admiradores.O material foi enviado para um grupo de professores, estudantes e pesquisadores de universidades europeias, liderados pela historiadora francesa Maud Chirio, professora da Universidade de Marne La Vallée e doutora pela Universidade Paris I, que prepara o lançamento de um site com essas cartas traduzidas para o inglês, italiano, francês e espanhol.",https://www.gazetadopovo.com.br/republica/lula-um-ano-de-prisao-financas-deterioradas/

,,,,"Centenas de golfinhos do tipo boto-cinza — 200 adultos e 25 filhotes — foram avistados, ao longo desta semana, na costa do Paraná. Os animais foram encontrados durante uma monitoramento da água feita por um especialista, à serviço da Administração dos Portos de Paranaguá e Antonina (APPA), para cumprimento das exigências ambientais de funcionamento dos portos.Os golfinhos monitorados são apenas parte da população total do Litoral do PR, que hoje está estimada entre 320 e 460 animais. Segundo o biólogo Fernando Augusto Hardt, que é responsável pelo monitoramento, o objetivo da tarefa é estimar a densidade populacional da espécie para avaliar a qualidade ambiental da região.Isso porque os animais estão expostos a diversos impactos, como poluição, tráfego de embarcações de todos os portes e atividade pesqueira. Entre as principais preocupações com a espécie, está o fato de que se trata de mamíferos, que precisam respirar. “Sem respirar eles podem morrer afogados. É o que acontece quando eles se emaranham nas redes de pesca”, alerta o especialista.A existência dos golfinhos, segundo o biólogo, é um bom indicativo não apenas para a própria espécie dos botos-cinza. Por estarem no topo da cadeia alimentar dos oceanos, eles acabam mostrando que existem animais que servem como suas presas vivendo na região, e consequentemente as presas dessas presas.De acordo com a APPA, esse tipo de mapeamento é feito a cada três meses. O biólogo contratado para a tarefa é responsável por tirar fotos de todos os golfinhos que encontra na costa, além de registrar as coordenadas geográficas do local dos achados. Posteriormente, essas imagens são analisadas e cada golfinho é identificado. “Os animais possuem marcas naturais na nadadeira dorsal e através dessa marca conseguimos identificar individualmente cada um deles”, afirma Hardt.Além dos botos, golfinhos e tartarugas, o Programa de Monitoramento da Biota Aquática e Biondicadores também acompanha os plânctons, bentos, peixes, camarões, siris e caranguejos e as aves.",https://www.gazetadopovo.com.br/curitiba/golfinhos-portos-parana/

,,,,"Em encontro com presidentes dos principais partidos do país na manhã desta quinta-feira (4), o presidente  anunciou a intenção de criar uma espécie de conselho político para aproximar o governo com as siglas e o Congresso Nacional. Prestes a completar cem dias de mandato, o presidente se reúne com dirigentes de 11 legendas para convidá-los a integrar a base de sustentação do governo no Congresso.A estratégia inicial de Bolsonaro de usar as frentes parlamentares para conseguir apoio no Congresso fracassou e o presidente foi aconselhado a abrir diálogo com os partidos, na volta da viagem a Israel, para aprovar a . Pelo Twitter, Bolsonaro disse que ""tudo ocorreu em alto nível"" e ""nada se falou sobre cargos"" nas reuniões que realizou com presidentes e líderes de partidos políticos. Para ele, as primeiras conversas demonstram que Executivo e Legislativo estão unidos pela reforma da Previdência.Durante as conversas desta manhã, Bolsonaro não pediu apoio formal, de acordo com fontes consultados pela reportagem. O presidente afirmou que o país precisa da ajuda de todos e avisou aos presidentes dos partidos que, caso eles não queiram fazer parte da base do governo, que pelo menos apoiassem as propostas prioritárias como a Previdência.O ministro da Casa Civil, Onyx Lorenzoni, explicou aos dirigentes partidários como funcionaria o conselho político. Seriam dois grupos que se reuniriam a cada 15 dias. O primeiro, formado por presidentes de partidos, o segundo por líderes do Congresso. Eles seriam recebidos ora pelo próprio presidente, ora por Lorenzoni.A medida é uma reação à força demonstrada pelo Centrão nas últimas semanas. No vácuo da articulação política, o grupo - formado por siglas como DEM, PP, PR, PRB, PSD e Solidariedade que em alguns casos tem como aliados o MDB e o PSDB - se organizou e impôs derrotas ao governo no Congresso.""O presidente fez um gesto. Não queremos cargos, queremos solução. Queremos ser recebidos por ministros e atendidos em nossas demandas"", afirmou o presidente do PRB, Marcos Pereira, o primeiro a se encontrar com Bolsonaro. Na quarta-feira (3), o vice-presidente Hamilton Mourão disse que, se as adesões ao Planalto forem aceitas, a coalizão terá como contrapartida cargos no governo. Nos bastidores, porém, Bolsonaro já avisou que, mesmo cedendo, não existirá ""porteira fechada"" na Esplanada ou em qualquer repartição federal para nenhum partido.""A partir do momento em que os partidos concordem com o que o governo pretende fazer, é óbvio que eles vão ter algum tipo de participação, seja em cargos nos Estados, algum ministério ou algo do gênero"", argumentou Mourão na quarta.No encontro, o ministro da Casa Civil afirmou aos presidentes dos partidos que era o primeiro de uma série. ""O diálogo está apenas começando"", disse Lorenzoni segundo um interlocutor que participou das reuniões do início da manhã.Bolsonaro tem encontros separados, nesta quinta-feira, com os presidentes do DEM, PSDB, MDB, PP, PSD e PRB.  As rodadas de conversa ocorrerão em duas etapas: na terça e quarta-feira, dias 9 e 10, Bolsonaro receberá dirigentes do PSL, PR, PROS, Podemos e Solidariedade. Até agora, apenas o PSL, seu partido, integra a base do governo no Congresso.Seu adversário na campanha de 2018, o ex-governador de São Paulo Geraldo Alckmin (PSDB) rebateu o discurso contra a velha política feito por Bolsonaro (PSL), após encontro entre os dois nesta quinta-feira no Palácio do Planalto. ""Não existe nova e velha, existe boa e má política. A boa política não envelhece"", afirmou Alckmin, que é presidente nacional do PSDB.O tucano afirmou que o PSDB manterá sua posição de independência em relação ao governo, ""não há nenhum tipo de troca, não participaremos do governo, não aceitamos cargo do governo, e votamos com o Brasil"".Depois de seguidas declarações de Bolsonaro associando negociações com o Congresso a corrupção e seu embate com o presidente da Câmara, Rodrigo Maia (DEM-RJ), Alckmin defendeu o diálogo. ""Quanto mais a gente ouve, menos a gente erra. Política não é troca-troca, é o diálogo"", disse.Ele citou o Ulysses Guimarães, que presidiu a Câmara e liderou a campanha pela redemocratização no fim da ditadura militar (1964-1985). ""Saber ouvir é uma grande virtude. Dr. Ulysses, que era um estadista, dizia que o homem tem dois ouvidos e uma boca para ouvir mais do que fala"", lembrou.Alckmin e Bolsonaro tiveram embates públicos durante a campanha. Mas na reunião nesta quinta, ""a conversa foi boa"", segundo o tucano. ""O presidente me cumprimentou falando, 'olha, votei em você nas últimas eleições'"", afirmou. ""Dr. Ulysses lembrava, não se guarda ressentimentos na geladeira.""O presidente do PSDB defendeu a aprovação da reforma da Previdência, mas fez ressalvas ao texto apresentado pelo governo. ""O importante na reforma é idade mínima e tempo de transição. A reforma é muito complexa, muito detalhista, muito longa"", comentou. ""Nós não aprovaremos nenhum benefício menor que um salário mínimo. O BPC (Benefício de Prestação Continuada) nós somos contra, como também a questão rural. Se há diferença de idade na área urbana, por que não há na área rural?"", questionou. O texto prevê que homens e mulheres se aposentem aos 60 anos no campo e 65 e 62, respectivamente, na cidade.""A reforma da Previdência precisa ser centrada em dois objetivos. O primeiro é justiça social. Não é possível permitir privilégios e é preciso proteger aqueles que mais precisam"", afirmou Alckmin.O PSDB não vetará que seus quadros relatem a reforma ao longo da tramitação no Congresso, segundo o presidente do partido. O tucano embarcará nesta quinta para Boston, nos Estados Unidos, para participar da Brazil Conference, evento sobre o país na universidade Harvard. Participará de um debate com outros dois ex-presidenciáveis, Ciro Gomes (PDT) e Henrique Meirelles (MDB).",https://www.gazetadopovo.com.br/republica/a-presidentes-de-partidos-bolsonaro-fala-em-criar-conselho-de-politicos/

,,,,"O sistema de saúde da Venezuela está em ""colapso total"", segundo um relatório, que mostra a disseminação exponencial de doenças que podem ser evitadas ​​por vacinação, como sarampo e difteria, e ""surtos dramáticos"" de doenças infecciosas, como malária e tuberculose.O relatório, divulgado nesta quinta-feira (4) pela Human
Rights Watch e pela Escola Bloomberg de Saúde Pública Johns Hopkins, está entre
os poucos que procuraram quantificar a miséria da Venezuela, pois o país deixou
de divulgar dados sobre saúde e nutrição e retaliou aqueles que o fizeram.Com base em entrevistas com médicos e outros profissionais de saúde na Venezuela, realizadas por telefone e online; refugiados na Colômbia e no Brasil, incluindo profissionais de saúde; e representantes de organizações humanitárias e internacionais, o relatório conclui que a Organização das Nações Unidas deve assumir a liderança no fornecimento de ajuda.A ONG apela ao secretário-geral da ONU, António Guterres, que
encabece os esforços para declarar uma emergência humanitária complexa, uma
designação oficial que desencadearia um esforço importante e abrangente sob os
auspícios da ONU e liberaria a mobilização de recursos internacionais.A ajuda humanitária à Venezuela tem sido lenta, comparada com a necessidade, por causa da intransigência do ditador Nicolás Maduro – que põe a culpa das privações nas sanções dos EUA e se recusou a permitir que a assistência entrasse no país, apenas recentemente concordando com a  – e a relutância de alguns doadores em permitir que a assistência seja distribuída pelo regime de Maduro.Uma declaração da ONU, afirmam os autores dos relatórios,
colocaria Guterres em posição de pressionar Maduro para permitir que as
agências da ONU liderassem e implementassem uma ajuda humanitária em larga
escala.Guterres disse que as Nações Unidas não deveriam se juntar a
nenhum dos grupos de nações que promovem várias soluções políticas para a crise
venezuelana. Eles incluem o Grupo de Lima – de 14 nações latino-americanas, que
junto com os Estados Unidos e alguns países europeus exigiram que Maduro deixe
o cargo em favor de Juan Guaidó, chefe da Assembleia Legislativa da Venezuela,
a quem eles reconheceram como presidente interino do país em janeiro.O governo Trump impôs duras sanções econômicas e
diplomáticas contra o governo de Maduro, ao mesmo tempo em que descarregava
centenas de toneladas de alimentos e suprimentos médicos ao longo da fronteira
venezuelana na vizinha Colômbia, que tiveram a entrada proibida por Maduro.Um grupo de contato da União Europeia e oito estados membros da UE, junto com quatro países latino-americanos – a maioria entre os 54 países que reconheceram Guaidó – pediu novas eleições. Separadamente, o México e o Uruguai dizem que adotaram uma postura ""neutra"", ainda reconhecendo Maduro e pedindo um diálogo político.As diferenças entre os grupos deixaram as Nações Unidas em
um tipo de dilema sobre como abordar a situação, enquanto evita uma posição
sobre qual deveria ser o resultado político. Outros membros importantes da ONU,
incluindo a Rússia, um aliado de Maduro, criticaram a interferência dos EUA.Perguntado se os Estados Unidos apoiariam a tomada do controle da ajuda pela ONU, Elliott Abrams, enviado especial do governo americano à Venezuela, disse que o relatório é consistente com os relatórios do governo dos EUA e ""contradiz os esforços do regime de Maduro para minimizar o trauma imposto ao povo venezuelano"". ""Os Estados Unidos continuam buscando formas de
fornecer assistência humanitária ao povo venezuelano"", disse Abrams.
""O regime deve sair do caminho e deixar de bloquear a maior parte da
assistência e politizar os montantes que estão disponíveis"".O governo americano denunciou que o apoio russo e cubano tem
mantido Maduro no poder. Após a chegada de cerca de 100 militares russos na
Venezuela, o presidente Donald Trump disse na semana passada que ""a Rússia
precisa sair"".Em uma entrevista de rádio na quarta-feira com Hugh Hewitt, o secretário de Estado Mike Pompeo disse que ""não pode falar sobre todas as opções que estão sendo consideradas"", mas que a recusa da Rússia em sair significa que ""nos voltaremos para outras ferramentas do poder americano"". Até agora, a administração Trump e seus parceiros não
conseguiram convencer os poderosos militares venezuelanos a se separarem de
Maduro, mesmo quando milhões de pessoas fugiram do país ou têm ido às ruas em
protesto.O novo relatório retrata uma imagem extremamente sombria da vida na Venezuela, cuja economia, que já foi próspera, implodiu por má administração e corrupção sob o regime de Maduro, presidente desde a morte do líder Hugo Chávez em 2013. As exportações de petróleo caíram para menos da metade.Além da desnutrição generalizada e do aumento acentuado dos níveis de mortalidade materna e infantil, mais de 9.300 casos de sarampo foram registrados desde junho de 2017, em comparação com um único caso registrado entre 2008 e 2015. ""A Venezuela não teve um único caso de difteria entre
2006 e 2015"", diz o relatório, ""mas mais de 2.500 casos suspeitos
foram relatados desde julho de 2016"".A eletricidade e a água estão cada vez mais escassas, assim como comida e medicamentos. O relatório citou um documento da Organização Pan-Americana da Saúde de 2018, que estima que quase 9 dos 10 venezuelanos vivendo com HIV não estavam recebendo tratamento. Observando que a privação há muito antecede as sanções
impostas recentemente pelos EUA, o documento diz que ""as autoridades
venezuelanas sob Maduro ocultaram as informações oficiais de saúde. Assediaram
e retaliaram quem coletou dados ou falou sobre escassez de alimentos e
remédios"".",https://www.gazetadopovo.com.br/mundo/colapso-total-doencas-ressurgem-enquanto-o-sistema-de-saude-definha/

"A reforma já se foi, mas isso agora é o de menos",,,,,https://www.gazetadopovo.com.br/colunistas/mario-vitor-rodrigues/a-reforma-ja-se-foi-mas-isso-agora-e-o-de-menos/

,,,,,https://www.gazetadopovo.com.br/viver-bem/saude-e-bem-estar/filhos/alimentacao-ajuda-acabar-com-espinhas/

A natureza é o melhor remédio,Leide Takahashi,[07/04/2019],Artigos,,https://www.gazetadopovo.com.br/opiniao/artigos/a-natureza-e-o-melhor-remedio-cgtpmxy0z0auu96lu9h5v1gtd

"Pedágios no Paraná, olhando para o amanhã",Bernardo Strobel Guimarães,[07/04/2019],Artigos,,https://www.gazetadopovo.com.br/opiniao/artigos/pedagios-no-parana-olhando-para-o-amanha-91hjnss56fabazdmz8r6fl74x

