titulo,autor,data,secao,texto,url
,,,,"O Conselho Administrativo de Defesa Econômica (Cade) divulgou nesta sexta-feira(5) estudo de seu departamento econômico (DEE) que conclui que existem riscos à concorrência se os ativos da Avianca, que está em recuperação judicial, forem comprados por qualquer empresa que já atue no setor aéreo brasileiro.O documento não representa uma decisão do Cade, mas servirá para subsidiar futuras análises do caso pelo conselho e é um prenúncio de que dificilmente a compra de ativos da Avianca, , pelas atuais líderes de mercado seria aprovada pelo órgão.De acordo com a nota técnica, a preocupação é maior se a , que entraram na disputa pela compra de unidades da concorrente nesta semana. As duas companhias já apresentam altas participações de mercado nas principais rotas em que a Avianca atua.No caso da compra pela Azul, que tem menor share, a preocupação do órgão é menor. ""Seria necessária, no entanto, uma análise profunda para uma conclusão sobre essa operação, que só é realizada quando da notificação da operação ao Cade"", afirma o departamento.A avaliação do departamento é que a compra da Avianca por uma empresa já no mercado brasileiro aumentaria a concentração em um setor já com poucas empresas e poderia levar ao aumento no preço das passagens. A conclusão do DEE é que a melhor solução, do ponto de vista da concorrência, seria um novo entrante assumir as unidades da Avianca, ou seja, uma empresa que ainda não atue no mercado de aviação aérea no Brasil.O departamento recomenda que os agentes responsáveis pelo processo de recuperação da Avianca levem em consideração o risco regulatório associado à venda dos ativos, inclusive a possibilidade de a operação ser barrada pelo Cade. ""Esse risco envolve não apenas a possibilidade de ter a operação reprovada com base no cenário atual, mas, também, o risco de não serem aceitas propostas de desinvestimentos apresentados pelas empresas; que a responsabilidade pelo ativo permanece com a empresa que o vende até a aprovação regulatória pelo Cade; que o tempo total de análise pelo Cade é de 240 dias, podendo ser estendido até por 90 dias; que a etapa de pré-notificação pode ser longa a depender das informações apresentadas pelas empresas e da complexidade da operação, entre outros fatores"", alerta.A nota técnica avalia que o setor de transporte aéreo brasileiro tem características que limitam a competição, como barreiras legais à entrada de novas empresas, necessidade de altos níveis de investimento e barreiras de infraestrutura em aeroportos. ""O plano (de recuperação da Avianca) poderia vir a impactar o comportamento dos agentes e, eventualmente, mudar o nível de preço para os consumidores"", conclui.",https://www.gazetadopovo.com.br/economia/compra-da-avianca-por-gol-e-latam-gera-risco-a-concorrencia-aponta-cade/

,,,,,https://www.gazetadopovo.com.br/bomgourmet/ovo-de-empada-de-frango-pascoa/

Números mostram que atleta trans tem desempenho inferior a rivais na Superliga,,[05/04/2019],Esportes,,https://www.gazetadopovo.com.br/esportes/numeros-mostram-que-atleta-trans-tem-desempenho-inferior-a-rivais-na-superliga-4hc6fxw0lf7x6m6l025sg4k0x

,,,,"A , enviada para apreciação dos vereadores em março, deve trazer alterações importantes no funcionamento de duas secretarias municipais. O projeto traz maior “autonomia” para que as pastas de  e  executem obras e serviços de engenharia.A prefeitura explica que a mudança diminuiria a atribuição da  em intervenções nos equipamentos públicos que estão sob responsabilidade da Educação e Saúde.. !Pelo modelo em vigor atualmente, as duas pastas podem realizar, sozinhas, somente pequenas manutenções em suas estruturas. Serviços de maior parte precisam passar pela Secretaria de Obras.Já com o novo texto, caso aprovado pelos vereadores, todos os serviços de engenharia das duas áreas ficariam a cargo das próprias secretarias. “Isto acaba por agilizar e especializar o atendimento, evitando idas e vindas do projeto e conversas para ajustes, uma vez que as equipes dedicadas estão mais voltadas para as demandas específicas”, justifica a prefeitura. Ainda segundo o Executivo, a nova medida deve otimizar tempo, processos e equipes, com resultados mais eficientes.Vale lembrar que obras de infraestrutura e em outras áreas, que não Saúde e Educação, permanecem no escopo de atuação da Secretaria de Obras.Na última semana, outra mudança importante no funcionamento da prefeitura foi aprovada, em primeiro turno, pelos vereadores da capital. Os parlamentares confirmaram uma alteração na Lei Orgânica do município, permitindo que a prefeitura contrate funcionários temporários, via , para todas as áreas do serviço público.Pela lei em vigor, o instrumento não pode ser aplicado em serviços que são executados regularmente por servidores públicos concursados – como é o caso das áreas de Saúde e Educação.A nova norma ainda não entrou em vigor porque precisa passar por uma segunda votação no plenário da Câmara, na sessão do dia 15 de abril. Se aprovado em segundo turno, o projeto vai para sanção do prefeito .Já a proposta de reforma administrativa da prefeitura deve levar algum tempo para ser, de fato, implementada. Isso porque o projeto precisa passar por toda a tramitação na Câmara: análise pela Comissão de Constituição e Justiça (CCJ), pelas comissões temáticas e por votação, em dois turnos, no plenário da Casa. Só então as alterações poderão ser sentidas na prática.",https://www.gazetadopovo.com.br/parana/reforma-curitiba-saude-educacao-mais-autonomia/

,,,,"O presidente  recebeu o ministro da Justiça e Segurança Pública, , na transmissão ao vivo que realiza toda semana nas redes sociais. Participou também o ministro do Gabinete de Segurança Institucional, o general Augusto Heleno.Bolsonaro abriu a live falando das  em busca de apoio para aprovar a . Ele negou que o tema distribuição de cargos tenha sido tratado nos encontros com PRB, PSD, PSDB, DEM, PP e MDB. O governo busca consolidar uma base aliada no Congresso. ""Tratamos de questões partidárias, governabilidade e nova Previdência"", disse. ""Eles têm o perfeito entendimento que querem colaborar não com o o governo, mas com o Brasil. Nada foi tratado sobre cargos, nem por parte deles nem da nossa parte. O Brasil está acima dos nossos interesses"", completou o presidente.Bolsonaro questionou ainda informação publicada pelo jornal Valor Econômico de que as reuniões com os partidos seriam gravadas. ""Isso não existe. Jamais darei qualquer oportunidade para que seja quebrada a confiança entre nós [partidos]”, disse. “O Parlamento vai fazer sua parte não só na reforma da Previdência, como em todas as nossas reformas”, completou.O presidente falou ainda na live da isenção de visto para turistas dos EUA, Canadá, Austrália e Japão - chamada por Moro de uma ""política inteligente que aquece o turismo"" - e da viagem que fez a Israel.E disse que irá anunciar na próxima semana o 13º salário para as famílias que recebem Bolsa Família, cumprindo uma promessa de campanha. Segundo ele, o dinheiro virá do combate a fraude no programa.Em clima descontraído, Bolsonaro mencionou a , exibindo uma folha de papel com o contato de Moro na rede social escrito. ""Se der errado, a culpa é dele [Bolsonaro]"", brincou o ministro.Segundo Moro, a ideia ao criar o perfil é de se ""comunicar de uma  maneira mais moderna, nas redes sociais"". Ele afirmou que usará a  plataforma principalmente para divulgar políticas públicas, e menos  posições pessoais.O
 perfil do ministro já tem cerca de 270 mil seguidores. Nele, Moro 
afirma que irá explicar ""o projeto de lei anticrime, além das medidas 
executivas em andamento do ministério"". Em sua participação na transmissão, Moro ainda falou sobre operações de combate à pornografia infantil e ao plantio de maconha, e sobre o pacote de leis anticrime no Congresso.Disse que tem conversado muito com parlamentares e ido com frequência ao Congresso. Na próxima semana, afirmou que vai se reunir com os relatores da proposta na Câmara e no Senado. ""Sinto uma grande receptividade, projetos estão andando"" declarou Moro.Ele afirmou que a expectativa é que o projeto seja votado após o término dos trabalho do comitê de estudo instituído na Câmara para unificar projeto apresentado pelo governo Bolsonaro com outro semelhante apresentado pelo então ministro da Justiça Alexandre de Moraes, atualmente ministro do Supremo Tribunal Federal. ""A expectativa é que seja votado em breve tão logo o grupo encerre os trabalhos"", disse Moro. O Senado também analisa o texto paralelamente para adiantar a discussão e acelerar a tramitação.""O que sinto dos parlamentares é receptividade. Com a liderança do senhor e dos parlamentares vamos conseguir deliberar sobre esse projeto e deliberá-lo em tempo breve"", disse Moro no vídeo.Bolsonaro afirmou que o Brasil deve potencializar negócios com os países árabes na próxima semana. ""Nós queremos ampliar negócios com o mundo todo, assim como Estados Unidos, estivemos no Chile, Israel, com a comunidade árabe também. Temos viagem marcada para a China no corrente ano, se deus quiser"", disse durante a transmissão ao vivo.O ministro Augusto Heleno deixou claro que o Brasil vai continuar a manter relações com a comunidade árabe.""Está dentro da orientação do presidente, em termo de política externa, procurarmos países que podem trazer benefícios para o Brasil, sem entrar em características do país políticas-ideológicas. Isso não é levado em conta em política externa. Lógico que temos restrições a algumas aberrações, mas normalmente vamos continuar a manter relações comerciais principalmente com a comunidade árabe"", disse Heleno.O ministro também destacou que o Brasil tem interesse em manter a balança comercial com a comunidade árabe. ""Eles são nossos parceiros economicamente e isso não vai ser afetado"", declarou.",https://www.gazetadopovo.com.br/republica/moro-bolsonaro-live-semanal-facebook/

,,,,"Entre todos os itens da agenda BC+, de medidas de desburocratização, barateamento e regulamentação de inovações no setor financeiro, o open banking é a grande missão do Banco Central em 2019. Espera-se que um desenho do modelo a ser adotado no Brasil seja apresentado ainda neste primeiro semestre e que ele seja colocado em prática em duas ou mais fases nos anos seguintes.Pelo conceito do open banking, os dados financeiros pertencem ao cliente, que pode escolher compartilhá-los com qualquer instituição financeira, para que ela ofereça a ele serviços mais baratos e melhores. Bancos tradicionais, digitais e fintechs poderão oferecer toda uma gama de produtos e serviços não só aos seus próprios clientes, mas aos clientes das outras instituições, de pagamentos instantâneos a crédito pessoal mais barato devido a uma avaliação de perfil mais profunda e ágil. O termo técnico para isso, segundo o Rafael Pereira, CEO da Rebel, plataforma online de empréstimos pessoais, é a interoperabilidade do sistema.Isso já acontece hoje, em alguma medida, com quem usa o aplicativo de organização financeira GuiaBolso e o autoriza a acessar dados do banco para monitorar suas finanças ou mesmo com as pequenas empresas clientes do Banco do Brasil que abrem seus dados na instituição para o sistema da startup de gestão financeira ContaAzul.Na prática, o open banking é feito por meio de Interfaces de Programação de Aplicação (APIs, na sigla em inglês), portanto os dados não são, efetivamente, visíveis a qualquer um dos atores do sistema e nem podem ser compartilhados livremente. É algo mais sofisticado, mas semelhante ao que foi pensado para o , o rol de bons pagadores que está à espera da sanção do presidente Jair Bolsonaro, em que um sistema de score ou notas foi criado pelos bureaus de crédito como forma de usar esses dados.Olhando para o que já está andamento no mundo hoje, o BC tem três caminhos para o open banking: o da regulação abrangente, com padronização das APIs, controle dos diferentes prestadores do serviço e sistema de governança responsável, por exemplo, por resolver disputas entre empresas e revisar periodicamente os padrões estabelecidos (caso do Reino Unido); o da regulação dos padrões de APIs, apenas, e adoção, mais tarde, de um papel de observador de uma etapa seguinte de autorregulação (caso de Singapura); e o da abertura dos dados seguida de uma autorregulação por si só, tendo a autoridade monetária mais como uma observadora de todo o processo (caso dos Estados Unidos).Segundo fontes do mercado que acompanham de perto as
discussões sobre a regulamentação do open banking, o Brasil deve ter um modelo
híbrido, importando boas práticas já em andamento em outros países, mas também
olhando para soluções que façam sentido no próprio quintal.Seja como for, a tendência é de que open banking aumente gradativamente
a competição no setor financeiro do país e, o mais importante, reduza custos.“O princípio do open banking já foi endereçado na Lei Geral de Proteção de Dados e está aí: ‘o dado é do cliente e tem que ser guardado de maneira segura’”, ressalta Pietro Bonfiglioli , cofundador da Fisher Venture Builder, que lançou no último mês de fevereiro o estudo “Regulação na era das fintechs”, em parceria com KPMG, Huck Otranto Camargo, Mutual, goLiza e Mercado Bitcoin.Para Bonfiglioli, foi a postura pró-inovação do BC nos últimos anos que possibilitou a regulação em áreas como meios de pagamento, crédito e crowdfunding e incentivou o crescimento do ecossistema de fintechs no país: de 53, em 2014, para 419, em 2018. Embora a agenda BC+ tenha sido criada em 2017 na gestão de Ilan Goldfajn, sob o governo de Michel Temer, ela foi abraçada pela nova gestão de Roberto Campos Neto, do governo Bolsonaro.A postura pró-ativa das próprias startups da área também tem sido fundamental. Há cinco ou seis anos, o comportamento geral dessas empresas era focar na solução das dores do usuários de maneira micro, passando bem longe de discussões com autoridades monetárias.De uns tempos para cá, viram-se, no entanto, obrigadas a adotar uma atuação macro para realmente mudar o jogo do setor financeiro brasileiro. A recente criação de entidades como a Associação Brasileira de Crédito Digital (ABCD) é parte desse esforço de encabeçar esse tipo de discussão de forma conjunta entre as fintechs.""O próprio BC tem feitos convites e procurado conversar com os protagonistas desse sistema, sentando não só com os bancos, mas com fintechs e outros players do mercado "", conta Benjamin Gleason, cofundador do GuiaBolso, que compõe também a ABCD.Ele acredita que mesmo que o BC consiga implantar alguma fase do open banking neste ano, os impactos da medida só devem vir em 2020, 2021. Gleason fala isso até mesmo por experiências como a do Reino Unido. Neste semana, a autoridade monetária deu uma bronca nos cinco maiores bancos do país por estarem demorando a adotar as funcionalidades do open banking em seus aplicativos para smartphone e determinou que essas instituições contratem agentes externos para acompanhá-los nessa adequação. Ou seja, mesmo em um processo mais controlado e fomentado pelo órgão público, a implementação do open banking enfrenta resistências e dificuldades.Embora a princípio, os bancos se mostrem mais resistentes à
ideia, o open banking trará oportunidades para os grandes e pequenos players do
setor.Para Bradesco, Banco do Brasil e Itaú, a grande vantagem para
os bancos será enxergar operações que antes não passavam pela sua instituição,
e isso ampliaria o leque de dados que o banco poderia tratar.“Se não tiver modelo de negócio com cesta de open banking,
dados e inteligência artificial, dificilmente a empresa consegue sair
vitoriosa”, afirmou Gustavo Fosse, diretor de TI do Banco do Brasil.Maurício Minas, do Bradesco, destacou que, com o open
banking, a receita com tarifas e também os spreads (a diferença entre o custo
de captação e os juros cobrados dos clientes) tendem a cair, e que os bancos
precisam estar preparados para conseguir receitas com outros benefícios do open
banking. Isso viria da venda de informações processadas por big data, defendeu
Minas.Atualmente, os bancos já fecham acordos voluntários com
outras instituições e precisam submeter contratos a uma longa avaliação
jurídica, para garantir que não haverá quebra de sigilo bancário. Com o open
banking, isso acontecerá de mais segura e rápida.Embora vejam todas essas vantagens competitivas com o open
banking, os bancos temem o espaço que essa regulamentação pode abrir para gigantes
da tecnologia, como a Amazon e Google.“O GuiaBolso tem hoje 500 mil clientes. Imagina se a Amazon,
com os clientes dela, decidisse a cada dois minutos bater no banco para
consolidar o extrato do cliente? Esse é o grande risco que a gente corre”, disse
o presidente do Bradesco, Octávio de Lazari, no fim de março.Ele disse isso se referindo à responsabilidade solidária dos
dados dos clientes prevista na regulamentação do cadastro positivo e que,
provavelmente, também figurará numa regulamentação do open banking.No geral, o grande objetivo dos bancos no país hoje é o
ganho de escala nas operações de crédito, como forma de ganhar rentabilidade frente
à inevitável queda do spread bancário. Lazari admite que a cobrança de tarifas
perde cada vez mais espaço frente às ofertas de produtos e serviços gratuitos
ou com custo muito abaixo da média do mercado por parte de fintechs e bancos
digitais.Não há, porém, qualquer ilusão de que os bancos, sozinhos,
conseguirão barrar a inovação no setor financeiro. Lazari deposita suas
esperanças no banco digital Next, hoje com cerca de 700 mil clientes. Seu
concorrente, o Nubank, já tem mais de 4 milhões de NuContas no país. “A nossa
expectativa é que a partir do segundo semestre o Next não dependa em nada do
Bradesco, nem para resultado”, afirmou o presidente do Bradesco.Para ele, a maior preocupação do Bradesco é garantir que esses novos clientes, que não estariam no Bradesco, se tornem clientes a partir do Next.",https://www.gazetadopovo.com.br/economia/open-banking-banco-central-2019/

"Sema diz que edital do IAP será substituído por um concurso maior, de toda a secretaria",,,,,https://www.gazetadopovo.com.br/blogs/concurseiros/2019/04/07/sema-diz-que-edital-do-iap-sera-substituido-por-um-concurso-maior-de-toda-a-secretaria/

,,,,"Há um mês no comando da Itaipu Binacional, o , diretor-geral brasileiro da hidrelétrica, fez questão de reforçar que sua intenção é manter o bom relacionamento com os municípios da região. Além de afirmar estar aberto a novos projetos, desde que dentro da missão da empresa, ele também lembrou que os royalties para as cidades serão ampliados, seguindo a Lei 13.661/2018.A perda dos valores arrecadados era um dos temores dos prefeitos, , (MDB). “Temos inúmeras demandas para apresentarmos ao novo comando de Itaipu. A maior delas é a manutenção do pagamento dos royalties e também dos convênios que estão em vigor”, comentou, à época.Em nota publicada no site da Itaipu, Luna observa que para os 16 municípios lindeiros ao reservatório, o porcentual de distribuição dos royalties vai para cumprir a legislação. A partir de agora, do montante passado pelo Tesouro Nacional, - e não mais 45% - será destinado aos municípios. Por outro lado, os estados perdem receita – de 45%, a fatia cai para . Os 10% restantes vão para o Ministério do Meio Ambiente, Ministério de Minas e Energia e Fundo Nacional de Desenvolvimento Científico e Tecnológico.As cidades que são vizinhas da Itaipu e que foram diretamente impactadas pela construção da Usina, que completa 45 anos de sua criação e 35 anos de geração de energia em 2019, vão repartir um bolo maior dos royalties. Ficam com eles 85% os recursos destinados aos municípios. O mesmo porcentual é usado para repartir o pão entre os estados.O general destacou a atuação socioambiental da hidrelétrica, que abrange 52 municípios e prometeu que os recursos continuarão a ser utilizados para esse fim, mas com extremo cuidado. Convênios, parcerias, projetos e patrocínios serão todos revisados. Luna já determinou inclusive a para centralizar as informações e articular as ações intersetoriais.“A ideia é de que, a partir dessa reavaliação e do combate ao desperdício, seja possível melhorar a qualidade do emprego dos recursos de Itaipu”, diz o diretor, que admite que a missão ampliada da binacional permitiu  em ações de recuperação de microbacias hidrográficas e na promoção dos Objetivos de Desenvolvimento Sustentável (ODS), que fazem parte da Agenda 2030.Ele também determinou que todos os pedidos feitos à Itaipu sejam analisados pela ótica de sua aderência à missão da hidrelétrica, à oportunidade, à disponibilidade e imprescindibilidade da despesa/investimento. ""Com mais rigor nos gastos, vamos ter condições de investir em projetos mais consistentes na região"", garante, prometendo abrir as portas para discutir projetos e soluções com os prefeitos. Apesar de concentrar seu foco na área de energia elétrica, e aparentemente também na conservação do meio-ambiente, afetado na construção da hidrelétrica, Itaipu também tem uma missão importante já engatilhada em termos de infraestrutura. É ela quem vai bancar a segunda ponte entre Brasil e Paraguai, cuja obra deve ter andamento ainda neste semestre.Até o dia 26 de abril, quando o Tratado de Itaipu completará 46 anos, a binacional deverá ter em mãos a documentação para o início da construção da ligação .Segundo o general Luna, a melhoria é mais do que necessária para o desenvolvimento da região. “Ela vai fortalecer o processo de integração regional e melhorar a infraestrutura para o comércio e o turismo entre os dois países”, fala.O projeto não é novo. Sua construção havia sido contratada em 2014 pelo Departamento Nacional de Infraestrutura, mas não saiu do papel por problemas financeiros. Sua retomada, ao , ocorre graças ao financiamento da Itaipu Binacional. Por meio de um convênio de delegação, todas as .A intenção é que a Ponte da Amizade fique exclusivamente
dedicada a veículos leves e ônibus de turismo.",https://www.gazetadopovo.com.br/parana/aumento-royalties-itaipu-municipios/

,,,,,https://www.gazetadopovo.com.br/

